{
  "alert_candidates": [],
  "analysis_release_id": "reliable_20260831_v3",
  "classification_through": "2026-09-01T00:00:00+00:00",
  "classified_no_theme_count": 0,
  "data_through": "2026-08-31T23:40:07+00:00",
  "emerging_signals": [],
  "existing_theme_metrics": [
    {
      "count": 6,
      "denominator": 10,
      "name": "Fleet mobile stability",
      "one_review_sensitivity_pp": 10.0,
      "platform": "All",
      "prior_count": 15,
      "prior_denominator": 30,
      "prior_rate_pct": 50.0,
      "product": "Fleet",
      "provisional_count": 0,
      "rate_change_pp": 10.0,
      "rate_pct": 60.0,
      "recommended_action": "Open a cross-platform reliability workstream covering crash, load, blank-state, and map paths.",
      "status": "insufficient_data",
      "theme_id": "fleet_mobile_stability",
      "window": "latest_30_vs_prior_60"
    },
    {
      "count": 1,
      "denominator": 10,
      "name": "Fleet access and recovery",
      "one_review_sensitivity_pp": 10.0,
      "platform": "All",
      "prior_count": 5,
      "prior_denominator": 30,
      "prior_rate_pct": 16.7,
      "product": "Fleet",
      "provisional_count": 0,
      "rate_change_pp": -6.7,
      "rate_pct": 10.0,
      "recommended_action": "Instrument session expiry, failed re-entry, MFA delivery, restart loops, reinstall, and app-data deletion.",
      "status": "insufficient_data",
      "theme_id": "fleet_access_recovery",
      "window": "latest_30_vs_prior_60"
    },
    {
      "count": 3,
      "denominator": 64,
      "name": "Driver HOS state integrity",
      "one_review_sensitivity_pp": 1.6,
      "platform": "All",
      "prior_count": 15,
      "prior_denominator": 100,
      "prior_rate_pct": 15.0,
      "product": "Driver",
      "provisional_count": 0,
      "rate_change_pp": -10.3,
      "rate_pct": 4.7,
      "recommended_action": "Join review evidence to duty-state transitions, sync delays, warnings, support cases, and incidents.",
      "status": "insufficient_data",
      "theme_id": "driver_hos_state_integrity",
      "window": "latest_30_vs_prior_60"
    },
    {
      "count": 7,
      "denominator": 64,
      "name": "Driver workflow friction",
      "one_review_sensitivity_pp": 1.6,
      "platform": "All",
      "prior_count": 8,
      "prior_denominator": 100,
      "prior_rate_pct": 8.0,
      "product": "Driver",
      "provisional_count": 0,
      "rate_change_pp": 2.9,
      "rate_pct": 10.9,
      "recommended_action": "Reduce interaction count and regression burden in vehicle selection, DVIR, HOS, and navigation.",
      "status": "watch",
      "theme_id": "driver_workflow_friction",
      "window": "latest_30_vs_prior_60"
    },
    {
      "count": 9,
      "denominator": 64,
      "name": "Driver app stability",
      "one_review_sensitivity_pp": 1.6,
      "platform": "All",
      "prior_count": 9,
      "prior_denominator": 100,
      "prior_rate_pct": 9.0,
      "product": "Driver",
      "provisional_count": 0,
      "rate_change_pp": 5.1,
      "rate_pct": 14.1,
      "recommended_action": "Gate releases on responsiveness and stability across app version, OS, device, and workflow cohorts.",
      "status": "watch",
      "theme_id": "driver_app_stability",
      "window": "latest_30_vs_prior_60"
    },
    {
      "count": 1,
      "denominator": 10,
      "name": "Fleet map stability",
      "one_review_sensitivity_pp": 10.0,
      "platform": "All",
      "prior_count": 4,
      "prior_denominator": 30,
      "prior_rate_pct": 13.3,
      "product": "Fleet",
      "provisional_count": 0,
      "rate_change_pp": -3.3,
      "rate_pct": 10.0,
      "recommended_action": "Diagnose failing map paths inside the broader Fleet stability workstream.",
      "status": "insufficient_data",
      "theme_id": "fleet_map_stability",
      "window": "latest_30_vs_prior_60"
    },
    {
      "count": 2,
      "denominator": 64,
      "name": "Driver safety and AI false detections",
      "one_review_sensitivity_pp": 1.6,
      "platform": "All",
      "prior_count": 5,
      "prior_denominator": 100,
      "prior_rate_pct": 5.0,
      "product": "Driver",
      "provisional_count": 0,
      "rate_change_pp": -1.9,
      "rate_pct": 3.1,
      "recommended_action": "Investigate perceived false detections and strengthen review and appeal paths.",
      "status": "insufficient_data",
      "theme_id": "driver_safety_false_detection",
      "window": "latest_30_vs_prior_60"
    },
    {
      "count": 3,
      "denominator": 64,
      "name": "Driver control and simplification requests",
      "one_review_sensitivity_pp": 1.6,
      "platform": "All",
      "prior_count": 3,
      "prior_denominator": 100,
      "prior_rate_pct": 3.0,
      "product": "Driver",
      "provisional_count": 0,
      "rate_change_pp": 1.7,
      "rate_pct": 4.7,
      "recommended_action": "Treat recurring restore, simplify, control, and status requests as a discovery portfolio.",
      "status": "insufficient_data",
      "theme_id": "driver_control_and_simplification_requests",
      "window": "latest_30_vs_prior_60"
    },
    {
      "count": 0,
      "denominator": 10,
      "name": "Fleet product requests",
      "one_review_sensitivity_pp": 10.0,
      "platform": "All",
      "prior_count": 0,
      "prior_denominator": 30,
      "prior_rate_pct": 0.0,
      "product": "Fleet",
      "provisional_count": 0,
      "rate_change_pp": 0.0,
      "rate_pct": 0.0,
      "recommended_action": "Monitor sparse Fleet requests rather than elevate them as a roadmap priority.",
      "status": "insufficient_data",
      "theme_id": "fleet_product_requests",
      "window": "latest_30_vs_prior_60"
    }
  ],
  "monitoring_run_id": "monitoring_20260831_reconcile_001",
  "schema_version": "2.0",
  "unclassified_review_count": 0
}
